{
  "schema_version": "fly-replay-v1",
  "mode": "UI_DEMO",
  "coordinate_system": "LOCAL_METERS",
  "provenance": "Synthetic offline demo generated by experimental/fly-heatnet/scripts/generate_ui_demo.py",
  "input": {
    "type": "FeatureCollection",
    "features": [
      {
        "type": "Feature",
        "properties": {
          "id": "src-1",
          "object_type": "heat_source",
          "label": "Source"
        },
        "geometry": {
          "type": "Point",
          "coordinates": [
            70,
            370
          ]
        }
      },
      {
        "type": "Feature",
        "properties": {
          "id": "cam-1",
          "object_type": "heat_chamber",
          "network_role": "existing"
        },
        "geometry": {
          "type": "Point",
          "coordinates": [
            190,
            370
          ]
        }
      },
      {
        "type": "Feature",
        "properties": {
          "id": "old-1",
          "object_type": "heat_network",
          "network_role": "existing",
          "diameter": 500
        },
        "geometry": {
          "type": "LineString",
          "coordinates": [
            [
              70,
              370
            ],
            [
              190,
              370
            ],
            [
              330,
              360
            ]
          ]
        }
      },
      {
        "type": "Feature",
        "properties": {
          "id": "oks-1",
          "object_type": "oks_connection_point",
          "flow_tph": 9.1
        },
        "geometry": {
          "type": "Point",
          "coordinates": [
            520,
            210
          ]
        }
      },
      {
        "type": "Feature",
        "properties": {
          "id": "oks-2",
          "object_type": "oks_connection_point",
          "flow_tph": 8.4
        },
        "geometry": {
          "type": "Point",
          "coordinates": [
            720,
            255
          ]
        }
      },
      {
        "type": "Feature",
        "properties": {
          "id": "oks-3",
          "object_type": "oks_connection_point",
          "flow_tph": 12.5
        },
        "geometry": {
          "type": "Point",
          "coordinates": [
            620,
            470
          ]
        }
      },
      {
        "type": "Feature",
        "properties": {
          "id": "oks-4",
          "object_type": "oks_connection_point",
          "flow_tph": 7.4
        },
        "geometry": {
          "type": "Point",
          "coordinates": [
            840,
            505
          ]
        }
      },
      {
        "type": "Feature",
        "properties": {
          "id": "bld-1",
          "object_type": "restriction",
          "restriction_type": "oks"
        },
        "geometry": {
          "type": "Polygon",
          "coordinates": [
            [
              [
                470,
                165
              ],
              [
                560,
                165
              ],
              [
                560,
                245
              ],
              [
                470,
                245
              ],
              [
                470,
                165
              ]
            ]
          ]
        }
      },
      {
        "type": "Feature",
        "properties": {
          "id": "bld-2",
          "object_type": "restriction",
          "restriction_type": "oks"
        },
        "geometry": {
          "type": "Polygon",
          "coordinates": [
            [
              [
                675,
                210
              ],
              [
                760,
                210
              ],
              [
                760,
                295
              ],
              [
                675,
                295
              ],
              [
                675,
                210
              ]
            ]
          ]
        }
      },
      {
        "type": "Feature",
        "properties": {
          "id": "bld-3",
          "object_type": "restriction",
          "restriction_type": "oks"
        },
        "geometry": {
          "type": "Polygon",
          "coordinates": [
            [
              [
                575,
                425
              ],
              [
                665,
                425
              ],
              [
                665,
                515
              ],
              [
                575,
                515
              ],
              [
                575,
                425
              ]
            ]
          ]
        }
      },
      {
        "type": "Feature",
        "properties": {
          "id": "bld-4",
          "object_type": "restriction",
          "restriction_type": "oks"
        },
        "geometry": {
          "type": "Polygon",
          "coordinates": [
            [
              [
                795,
                462
              ],
              [
                890,
                462
              ],
              [
                890,
                548
              ],
              [
                795,
                548
              ],
              [
                795,
                462
              ]
            ]
          ]
        }
      },
      {
        "type": "Feature",
        "properties": {
          "id": "park-1",
          "object_type": "restriction",
          "restriction_type": "park"
        },
        "geometry": {
          "type": "Polygon",
          "coordinates": [
            [
              [
                405,
                300
              ],
              [
                555,
                300
              ],
              [
                555,
                395
              ],
              [
                405,
                395
              ],
              [
                405,
                300
              ]
            ]
          ]
        }
      },
      {
        "type": "Feature",
        "properties": {
          "id": "road-1",
          "object_type": "restriction",
          "restriction_type": "road"
        },
        "geometry": {
          "type": "Polygon",
          "coordinates": [
            [
              [
                320,
                135
              ],
              [
                365,
                135
              ],
              [
                365,
                565
              ],
              [
                320,
                565
              ],
              [
                320,
                135
              ]
            ]
          ]
        }
      },
      {
        "type": "Feature",
        "properties": {
          "id": "water-1",
          "object_type": "restriction",
          "restriction_type": "water"
        },
        "geometry": {
          "type": "Polygon",
          "coordinates": [
            [
              [
                695,
                355
              ],
              [
                930,
                355
              ],
              [
                930,
                410
              ],
              [
                695,
                410
              ],
              [
                695,
                355
              ]
            ]
          ]
        }
      }
    ]
  },
  "initial": {
    "type": "FeatureCollection",
    "features": [
      {
        "type": "Feature",
        "properties": {
          "id": "new-0-a",
          "object_type": "heat_network",
          "network_role": "new",
          "status": "accepted",
          "diameter": 125,
          "message": "B2-C initial branch"
        },
        "geometry": {
          "type": "LineString",
          "coordinates": [
            [
              190,
              370
            ],
            [
              360,
              370
            ],
            [
              515,
              260
            ]
          ]
        }
      },
      {
        "type": "Feature",
        "properties": {
          "id": "new-0-b",
          "object_type": "heat_network",
          "network_role": "new",
          "status": "accepted",
          "diameter": 80,
          "message": "Final approach"
        },
        "geometry": {
          "type": "LineString",
          "coordinates": [
            [
              515,
              260
            ],
            [
              520,
              210
            ]
          ]
        }
      }
    ]
  },
  "initial_metrics": {
    "connected_oks": 1,
    "total_oks": 4,
    "flow_tph": 28.2,
    "new_network_length_m": 343.5,
    "cost_rub": 49700000,
    "score": 18.76,
    "checker_status": "VALID",
    "action_ms": 0,
    "animation_ms": 1050
  },
  "steps": [
    {
      "id": "step-001",
      "operation": "JUNCTION_TO_OKS",
      "message": "Connect oks-2 through the existing shared branch.",
      "status": "committed",
      "candidate": {
        "type": "FeatureCollection",
        "features": [
          {
            "type": "Feature",
            "properties": {
              "id": "new-1-a",
              "object_type": "heat_network",
              "network_role": "new",
              "status": "accepted",
              "diameter": 100,
              "message": "Shared branch to oks-2"
            },
            "geometry": {
              "type": "LineString",
              "coordinates": [
                [
                  515,
                  260
                ],
                [
                  700,
                  258
                ],
                [
                  720,
                  255
                ]
              ]
            }
          }
        ]
      },
      "after": {
        "type": "FeatureCollection",
        "features": [
          {
            "type": "Feature",
            "properties": {
              "id": "new-0-a",